{
  "request_id": "53ed91c2-b779-41fe-9200-b66c28a9be44",
  "method": "case.commit",
  "status": "completed",
  "submitted_at": "2026-10-10T16:27:39.106509056+00:00",
  "completed_at": "2026-10-10T16:27:39.120813913+00:00",
  "outcome": {
    "case_id": "case_20261010T162739Z_997a1a",
    "exit_code": 5,
    "state": "active"
  },
  "payload_hash": "42258a2a3d83c0be2b6da98bffe907dae2e5e4fcbfa44598f091a7bba7fb061d",
  "locator": "case_20261010T162739Z_997a1a"
}